{
    "$schema": "./schema.json",
    "version": "1.0.0",
    "commit": "51a7e5b62ecdba50702dd4128b040b1564fcf195",
    "date": "2026-10-23",
    "suites": {
        "unit": {
            "vitest": "5.0.0",
            "command": "vitest run --coverage --exclude src/react/__tests__/hostileCost.spec.tsx && vitest run src/react/__tests__/hostileCost.spec.tsx --coverage.enabled=false",
            "passed": 4798,
            "failed": 0,
            "skipped": 6
        },
        "chromium": {
            "browserVersion": "148.0.7778.96",
            "playwright": "1.60.0",
            "command": "playwright test --project=chromium --project=webkit",
            "passed": 789,
            "failed": 0,
            "flaky": 0,
            "skipped": 14
        },
        "firefox": {
            "browserVersion": "150.0.2",
            "playwright": "1.60.0",
            "pendingIn": "rich-text-editor-pull-requests.yaml: Component Tests"
        },
        "webkit": {
            "browserVersion": "26.4",
            "playwright": "1.60.0",
            "command": "playwright test --project=chromium --project=webkit",
            "passed": 759,
            "failed": 0,
            "flaky": 0,
            "skipped": 44
        }
    },
    "performance": {
        "pendingIn": "rich-text-editor-pull-requests.yaml: Performance"
    },
    "bundle": [
        {
            "build": "./reader",
            "budgetBytes": 25781,
            "test": "src/reader/__tests__/bundleSize.spec.ts",
            "passed": true
        },
        {
            "build": "./model",
            "budgetBytes": 26000,
            "test": "src/model/__tests__/bundleSize.spec.ts",
            "passed": true
        },
        {
            "build": "./codecs",
            "budgetBytes": 77000,
            "test": "src/codecs/__tests__/bundleSize.spec.ts",
            "passed": true
        },
        {
            "build": "./html",
            "budgetBytes": 40000,
            "test": "src/runtime/import/__tests__/bundleSize.spec.ts",
            "passed": true
        },
        {
            "build": "inline-profile",
            "budgetBytes": 243000,
            "test": "src/plugins/profiles/__tests__/profilesBundleSize.spec.ts",
            "passed": true
        },
        {
            "build": "comment-profile",
            "budgetBytes": 243000,
            "test": "src/plugins/profiles/__tests__/profilesBundleSize.spec.ts",
            "passed": true
        },
        {
            "build": "document-profile",
            "budgetBytes": 245000,
            "test": "src/plugins/profiles/__tests__/profilesBundleSize.spec.ts",
            "passed": true
        },
        {
            "build": "brand-document-profile",
            "budgetBytes": 245000,
            "test": "src/plugins/profiles/__tests__/profilesBundleSize.spec.ts",
            "passed": true
        },
        {
            "build": "./features",
            "budgetBytes": 7000,
            "test": "src/plugins/__tests__/bundleSize.spec.ts",
            "passed": true
        },
        {
            "build": "./locales/*",
            "budgetBytes": 6000,
            "test": "src/locales/__tests__/bundleSize.spec.ts",
            "passed": true
        },
        {
            "build": "package-css",
            "budgetBytes": 5000,
            "test": "src/styles/__tests__/bundleSize.spec.ts",
            "passed": true
        }
    ],
    "findings": [],
    "acceptedFailures": []
}
